{
  "$schema": "https://json-schema.org/draft/2020-12/schema",
  "$id": "segments.schema.json",
  "title": "Resolved selection segments (segments/segments.json)",
  "description": "Canonical, hashed resolution of a project's `selection` into ordered source-time segments. Absent/null selection resolves to a single whole-video segment [0, source_duration_ms].",
  "type": "object",
  "additionalProperties": false,
  "required": [
    "schema_version",
    "project_id",
    "whole_video",
    "join_clips",
    "snap_edges",
    "snap_search_window_ms",
    "source_duration_ms",
    "segments",
    "selection_hash",
    "resolved_at",
    "resolved_by"
  ],
  "properties": {
    "schema_version": { "type": "string" },
    "project_id": { "type": "string" },
    "whole_video": {
      "type": "boolean",
      "description": "true when selection was null/absent: a single implicit segment covering the entire source. Drives the mux fast path (-c:v copy)."
    },
    "join_clips": {
      "type": "boolean",
      "description": "true => concatenate segments (in list order) into one deliverable; false => one deliverable per segment. Irrelevant when whole_video is true."
    },
    "snap_edges": {
      "type": "boolean",
      "description": "Resolved project default for edge snapping (per-segment `exact` overrides this)."
    },
    "snap_search_window_ms": {
      "type": "integer",
      "minimum": 0,
      "description": "Max distance (ms) a window edge was allowed to move to reach a snap candidate."
    },
    "source_duration_ms": {
      "type": "integer",
      "minimum": 0,
      "description": "Full source duration in ms (from source/metadata.json)."
    },
    "segments": {
      "type": "array",
      "minItems": 1,
      "items": {
        "type": "object",
        "additionalProperties": false,
        "required": [
          "index",
          "id",
          "requested_start_ms",
          "requested_end_ms",
          "start_ms",
          "end_ms",
          "snapped",
          "exact"
        ],
        "properties": {
          "index": { "type": "integer", "minimum": 0, "description": "Position in the resolved list; drives output order and per-segment paths." },
          "id": { "type": "string", "description": "Human-stable id (from selection or auto-assigned, e.g. seg0)." },
          "label": { "type": ["string", "null"] },
          "requested_start_ms": { "type": "integer", "minimum": 0, "description": "Window start as requested (pre-snap)." },
          "requested_end_ms": { "type": "integer", "minimum": 0, "description": "Window end as requested (pre-snap)." },
          "start_ms": { "type": "integer", "minimum": 0, "description": "Resolved (post-snap) start on the absolute source timeline." },
          "end_ms": { "type": "integer", "minimum": 0, "description": "Resolved (post-snap) end on the absolute source timeline." },
          "snapped": { "type": "boolean", "description": "true if either edge moved from the requested value during resolution." },
          "exact": { "type": "boolean", "description": "Effective exact-cut flag applied to this segment (per-window exact OR global !snap_edges)." },
          "adjustments": {
            "type": "array",
            "description": "Human-facing notes about how each edge resolved (snapped, left-as-requested, refused).",
            "items": {
              "type": "object",
              "additionalProperties": false,
              "required": ["edge", "kind", "requested_ms", "resolved_ms"],
              "properties": {
                "edge": { "type": "string", "enum": ["start", "end"] },
                "kind": { "type": "string", "enum": ["snapped", "exact", "unsnapped-no-candidate", "snap-refused"] },
                "requested_ms": { "type": "integer" },
                "resolved_ms": { "type": "integer" },
                "detail": { "type": ["string", "null"] }
              }
            }
          },
          "has_speech": { "type": ["boolean", "null"], "description": "Whether any full-transcript cue overlaps this window; null when unknown (no transcript consulted)." },
          "clip_wav": { "type": ["string", "null"], "description": "Project-relative path to the extracted clip WAV (set by `segments cut`)." },
          "clip_video": { "type": ["string", "null"], "description": "Project-relative path to the extracted clip video (set by `segments cut`; null on the whole-video fast path)." }
        }
      }
    },
    "selection_hash": {
      "type": "string",
      "pattern": "^sha256:[0-9a-f]{64}$",
      "description": "Stable hash over the canonical resolved segment list; threaded into downstream artifact provenance so a changed selection invalidates bound approvals."
    },
    "notes": {
      "type": "array",
      "items": { "type": "string" },
      "description": "Informational resolution notes (overlaps, out-of-order re-sequencing, empty-speech windows)."
    },
    "resolved_at": { "type": "string" },
    "resolved_by": { "type": "string" }
  }
}
