{
  "schema_version": "1.0",
  "project_id": "yt-YP0FDR7Wc-8",
  "whole_video": true,
  "join_clips": true,
  "snap_edges": true,
  "snap_search_window_ms": 2000,
  "source_duration_ms": 1479294,
  "segments": [
    {
      "index": 0,
      "id": "whole",
      "label": null,
      "requested_start_ms": 0,
      "requested_end_ms": 1479294,
      "start_ms": 0,
      "end_ms": 1479294,
      "snapped": false,
      "exact": true,
      "adjustments": [],
      "has_speech": true,
      "clip_wav": null,
      "clip_video": null
    }
  ],
  "selection_hash": "sha256:96563d1507f2ca76a50617e88cb42041ec986bbe6434fbe9b336a7bff9e30a81",
  "notes": [],
  "resolved_at": "2026-08-05T13:26:37Z",
  "resolved_by": "agent"
}
